{
  "schema_version": 1,
  "registry_role": "base-change-proposal-index",
  "proposal_root": "[수정제안서]",
  "proposals": [
    {
      "proposal_id": "BCP-2026-001-base-skill-map-publication",
      "title": "Base 공용 Skill Registry의 선택적 사람용 Map 발행",
      "path": "[수정제안서]/BCP-2026-001-base-skill-map-publication/PROPOSAL.md",
      "status": "IMPLEMENTED",
      "source_project": "alsdmlals4-eng/Base",
      "source_commit": "bc0eadca1c5c73ee4d5afd907d620953dbe02590",
      "submitted_at": "2026-07-19",
      "approval_ref": "[수정제안서]/BCP-2026-001-base-skill-map-publication/PROPOSAL.md#승인과-구현",
      "implementation_pr": "https://github.com/alsdmlals4-eng/Base/pull/264"
    },
    {
      "proposal_id": "BCP-2026-002-actions-node24-compatibility",
      "title": "GitHub Actions Node 24 호환 버전 전환",
      "path": "[수정제안서]/BCP-2026-002-actions-node24-compatibility/PROPOSAL.md",
      "status": "IMPLEMENTED",
      "source_project": "alsdmlals4-eng/Base",
      "source_commit": "c85e40855400a7595bf8b1350cba53a0e3c7e94d",
      "submitted_at": "2026-07-19",
      "approval_ref": "docs/superpowers/specs/2026-08-10-approved-base-continuity-diagnostics-actions-design.md",
      "implementation_pr": "https://github.com/alsdmlals4-eng/Base/pull/262"
    },
    {
      "proposal_id": "BCP-2026-003-ai-model-prompt-cost-optimization",
      "title": "AI 모델 라우팅·프롬프트 캐싱 비용 최적화",
      "path": "[수정제안서]/BCP-2026-003-ai-model-prompt-cost-optimization/PROPOSAL.md",
      "status": "IMPLEMENTED",
      "source_project": "alsdmlals4-eng/Base",
      "source_commit": "a82976a3a42450ea413cdc5d4aebf701678110d8",
      "submitted_at": "2026-07-31",
      "approval_ref": "https://github.com/alsdmlals4-eng/Base/issues/113",
      "implementation_pr": "https://github.com/alsdmlals4-eng/Base/pull/118"
    },
    {
      "proposal_id": "BCP-2026-004-ai-instruction-context-ui-motion",
      "title": "판단 중심 AI 지시·컨텍스트 큐레이션·UI 모션 원칙 통합",
      "path": "[수정제안서]/BCP-2026-004-ai-instruction-context-ui-motion/PROPOSAL.md",
      "status": "IMPLEMENTED",
      "source_project": "alsdmlals4-eng/Base",
      "source_commit": "7978093e16577f1a4e2f60fbc85ebf25d906673b",
      "submitted_at": "2026-08-01",
      "approval_ref": "https://github.com/alsdmlals4-eng/Base/issues/115",
      "implementation_pr": "https://github.com/alsdmlals4-eng/Base/pull/118"
    },
    {
      "proposal_id": "BCP-2026-005-godot-live-editor-contract-v2",
      "title": "Godot Live Editor 안전 계약 v2 정규화",
      "path": "[수정제안서]/BCP-2026-005-godot-live-editor-contract-v2/PROPOSAL.md",
      "status": "IMPLEMENTED",
      "source_project": "alsdmlals4-eng/Base",
      "source_commit": "83683eecaaeaf415bf629fe5a1231fc6cef575f3",
      "submitted_at": "2026-08-05",
      "approval_ref": "https://github.com/alsdmlals4-eng/Base/pull/154#issuecomment-5187157323",
      "implementation_pr": "https://github.com/alsdmlals4-eng/Base/pull/161"
    },
    {
      "proposal_id": "BCP-2026-006-game-youtube-devlog-marketing-workflow",
      "title": "게임 개발 YouTube 개발일지·마케팅 제작 Workflow",
      "path": "[수정제안서]/BCP-2026-006-game-youtube-devlog-marketing-workflow/PROPOSAL.md",
      "status": "IMPLEMENTED",
      "source_project": "alsdmlals4-eng/Base",
      "source_commit": "ecbd93f16b65a1527269bfd8fef9facad6b2f40b",
      "submitted_at": "2026-08-05",
      "approval_ref": "https://github.com/alsdmlals4-eng/Base/pull/167#issuecomment-5192600204",
      "implementation_pr": "https://github.com/alsdmlals4-eng/Base/pull/174"
    },
    {
      "proposal_id": "BCP-2026-007-cloud-run-game-backend-and-entitlement-integrity",
      "title": "Cloud Run 게임 백엔드·플랫폼 권한·무결성 보호 계약",
      "path": "[수정제안서]/BCP-2026-007-cloud-run-game-backend-and-entitlement-integrity/PROPOSAL.md",
      "status": "IMPLEMENTED",
      "source_project": "alsdmlals4-eng/Base",
      "source_commit": "1b323b2e16b65a1527269bfd8fef9facad6b2f40b",
      "submitted_at": "2026-08-05",
      "approval_ref": "https://github.com/alsdmlals4-eng/Base/pull/170#issuecomment-5192884554",
      "implementation_pr": "https://github.com/alsdmlals4-eng/Base/pull/181"
    },
    {
      "proposal_id": "BCP-2026-008-agentic-spec-design-ui-procurement-integration",
      "title": "에이전트 명세·디자인·외부 UI 조달 책임의 선택적 통합",
      "path": "[수정제안서]/BCP-2026-008-agentic-spec-design-ui-procurement-integration/PROPOSAL.md",
      "status": "IMPLEMENTED",
      "source_project": "alsdmlals4-eng/Base",
      "source_commit": "c7e678c928d08e736694319184f090ee87009efc",
      "submitted_at": "2026-08-06",
      "approval_ref": "https://github.com/alsdmlals4-eng/Base/pull/190#issuecomment-5198050799",
      "implementation_pr": "https://github.com/alsdmlals4-eng/Base/pull/192",
      "historical_reconciliation": true
    },
    {
      "proposal_id": "BCP-2026-009-serial-fiction-writing-and-revision-discipline",
      "title": "연재소설 집필·퇴고 공용 Discipline",
      "path": "[수정제안서]/BCP-2026-009-serial-fiction-writing-and-revision-discipline/PROPOSAL.md",
      "status": "IMPLEMENTED",
      "source_project": "Coc 폭풍의 눈(주안편)",
      "source_commit": "fa69a77a14f923a756064f6ae151d34cadb374f7",
      "submitted_at": "2026-08-08",
      "approval_ref": "[수정제안서]/BCP-2026-009-serial-fiction-writing-and-revision-discipline/PROPOSAL.md#승인과-구현",
      "implementation_pr": "https://github.com/alsdmlals4-eng/Base/pull/225"
    },
    {
      "proposal_id": "BCP-2026-010-continuous-work-execution-trigger",
      "title": "`[연속작업] 진행해` 연속작업 실행 루프",
      "path": "[수정제안서]/BCP-2026-010-continuous-work-execution-trigger/PROPOSAL.md",
      "status": "IMPLEMENTED",
      "source_project": "alsdmlals4-eng/Base",
      "source_commit": "a912cc001ff4d4e3415fb4b4931723c49eb08d9a",
      "submitted_at": "2026-08-08",
      "approval_ref": "[수정제안서]/BCP-2026-010-continuous-work-execution-trigger/PROPOSAL.md#승인과-구현",
      "implementation_pr": "https://github.com/alsdmlals4-eng/Base/pull/228"
    },
    {
      "proposal_id": "BCP-2026-011-game-feature-design-spec-system",
      "title": "게임 기능 세부기획 Spec 계층 통합",
      "path": "[수정제안서]/BCP-2026-011-game-feature-design-spec-system/PROPOSAL.md",
      "status": "IMPLEMENTED",
      "source_project": "alsdmlals4-eng/Base",
      "source_commit": "2a6ced23f6d6de1fb6e0a281c7138beb03f1a13b",
      "submitted_at": "2026-08-10",
      "approval_ref": "[수정제안서]/BCP-2026-011-game-feature-design-spec-system/PROPOSAL.md#승인과-구현",
      "implementation_pr": "https://github.com/alsdmlals4-eng/Base/pull/231"
    },
    {
      "proposal_id": "BCP-2026-012-serial-fiction-canon-migration-debt",
      "title": "연재소설 Canon Migration Debt lifecycle",
      "path": "[수정제안서]/BCP-2026-012-serial-fiction-canon-migration-debt/PROPOSAL.md",
      "status": "IMPLEMENTED",
      "source_project": "alsdmlals4-eng/Coc-Fiction",
      "source_commit": "c9c4fa647c833470759ada2514e45d1b2abb1e8b",
      "submitted_at": "2026-08-10",
      "approval_ref": "[수정제안서]/BCP-2026-012-serial-fiction-canon-migration-debt/PROPOSAL.md#승인과-구현",
      "implementation_pr": "https://github.com/alsdmlals4-eng/Base/pull/265"
    },
    {
      "proposal_id": "BCP-2026-013-post-merge-continuation-state-reconciliation",
      "title": "Post-Merge Continuation-State Reconciliation",
      "path": "[수정제안서]/BCP-2026-013-post-merge-continuation-state-reconciliation/PROPOSAL.md",
      "status": "IMPLEMENTED",
      "source_project": "alsdmlals4-eng/ninja-survival-godot",
      "source_commit": "9b85cf65a3ca4278f7d8ec1a7e527ecc857cbad1",
      "submitted_at": "2026-08-10",
      "approval_ref": "docs/superpowers/specs/2026-08-10-approved-base-continuity-diagnostics-actions-design.md",
      "implementation_pr": "https://github.com/alsdmlals4-eng/Base/pull/260"
    },
    {
      "proposal_id": "BCP-2026-014-handoff-machine-consumer-compatibility-closeout",
      "title": "BCP - 괴이기록국(urban-legend)",
      "path": "[수정제안서]/BCP-2026-014-handoff-machine-consumer-compatibility-closeout/PROPOSAL.md",
      "status": "IMPLEMENTED",
      "source_project": "alsdmlals4-eng/urban-legend",
      "source_commit": "2b424906c4ecaa4a027719383d3400486b03c72e",
      "submitted_at": "2026-08-10",
      "approval_ref": "docs/superpowers/specs/2026-08-10-approved-base-continuity-diagnostics-actions-design.md",
      "implementation_pr": "https://github.com/alsdmlals4-eng/Base/pull/260"
    },
    {
      "proposal_id": "BCP-2026-015-external-runtime-session-same-snapshot-recovery",
      "title": "BCP - OMENWARD",
      "path": "[수정제안서]/BCP-2026-015-external-runtime-session-same-snapshot-recovery/PROPOSAL.md",
      "status": "IMPLEMENTED",
      "source_project": "alsdmlals4-eng/omenward",
      "source_commit": "bde85549560fca90f7aa25fc4842bc0a3afb92e7",
      "submitted_at": "2026-08-10",
      "approval_ref": "[수정제안서]/BCP-2026-015-external-runtime-session-same-snapshot-recovery/PROPOSAL.md#승인과-구현",
      "implementation_pr": "https://github.com/alsdmlals4-eng/Base/pull/266"
    },
    {
      "proposal_id": "BCP-2026-016-live-source-handoff-semantic-consumer-reconciliation",
      "title": "BCP - Switchy Express: Cargo Puzzle",
      "path": "[수정제안서]/BCP-2026-016-live-source-handoff-semantic-consumer-reconciliation/PROPOSAL.md",
      "status": "IMPLEMENTED",
      "source_project": "alsdmlals4-eng/Switchy-Express-Cargo-Puzzle",
      "source_commit": "eb07dcc39b9675a54c675694236f507a8e50e78a",
      "submitted_at": "2026-08-10",
      "approval_ref": "docs/superpowers/specs/2026-08-10-approved-base-continuity-diagnostics-actions-design.md",
      "implementation_pr": "https://github.com/alsdmlals4-eng/Base/pull/260"
    },
    {
      "proposal_id": "BCP-2026-017-serial-fiction-reconciliation-frontier-and-derived-continuity-guard",
      "title": "BCP - Coc-Fiction",
      "path": "[수정제안서]/BCP-2026-017-serial-fiction-reconciliation-frontier-and-derived-continuity-guard/PROPOSAL.md",
      "status": "IMPLEMENTED",
      "source_project": "alsdmlals4-eng/Coc-Fiction",